"name","age","hometown","boarded","destination","lifeboat","body","class","homecountry","survivaloutcome","position","crew","sex","agecharacter"
"Mallet, Master André Clément",1,"Montreal, Quebec, Canada","Cherbourg","Montreal, Quebec, Canada","10",NA,"Second",NA,"Survived",NA,"Not Crew","Male","1"
"Mangiavacchi, Mr. Serafino Emilio",30,"Paris, France","Cherbourg","New York City",NA,NA,"Second",NA,"Perished",NA,"Not Crew","Male","30"
"Matthews, Mr. William John",30,"St Austell, Cornwall, England","Southampton","La Salle, Illinois, US",NA,NA,"Second",NA,"Perished",NA,"Not Crew","Male","30"
"Maybery, Mr. Frank Hubert",36,"Weston-super-Mare, North Somerset, England","Southampton","Moose Jaw, Saskatchewan, Canada",NA,NA,"Second",NA,"Perished",NA,"Not Crew","Male","36"
"McCrae, Mr. Arthur Gordon",32,"Sydney, New South Wales, Australia","Southampton","Canada",NA,"209","Second",NA,"Perished",NA,"Not Crew","Male","32"
"McCrie, Mr. James Matthew",32,"Sarnia, Ontario, Canada","Southampton","Sarnia, Ontario, Canada",NA,NA,"Second",NA,"Perished",NA,"Not Crew","Male","32"
"McKane, Mr. Peter David",46,"Guernsey, Channel Islands","Southampton","Rochester, New York, US",NA,NA,"Second",NA,"Perished",NA,"Not Crew","Male","46"
"Mellinger, Mrs. Elizabeth Anne (née Maidment)",41,"Wimbledon, London, England","Southampton","Bennington, Vermont, US","14",NA,"Second",NA,"Survived",NA,"Not Crew","Female","41"
"Mellinger, Miss Madeleine Violet",13,"Wimbledon, London, England","Southampton","Bennington, Vermont, US","14",NA,"Second",NA,"Survived",NA,"Not Crew","Female","13"
"Mellors, Mr. William John",19,"Chelsea, London, England","Southampton","Long Island, New York, US","B",NA,"Second",NA,"Survived",NA,"Not Crew","Male","19"
"Meyer, Mr. August",31,"Harrow, London, England","Southampton","New York City",NA,NA,"Second",NA,"Perished",NA,"Not Crew","Male","31"
"Milling, Mr. Jacob Christian",48,"Odense, Denmark","Southampton","Oregon, Wisconsin, US",NA,"271","Second",NA,"Perished",NA,"Not Crew","Male","48"
"Mitchell, Mr. Henry Michael",71,"Guernsey, Channel Islands","Southampton","Toledo, Ohio, US",NA,NA,"Second",NA,"Perished",NA,"Not Crew","Male","71"
"Montvila, Father Juozas",27,"Gudinė, Lithuania","Southampton","Worcester, Massachusetts, US",NA,NA,"Second",NA,"Perished",NA,"Not Crew","Male","27"
"Moraweck, Dr. Ernest",54,"Frankfort, Kentucky, US","Southampton","Frankfort, Kentucky, US",NA,NA,"Second",NA,"Perished",NA,"Not Crew","Male","54"
"Morley, Mr. Henry Samuel (alias Mr. Henry Marshall)",38,"Birmingham, Worcester, England","Southampton","Los Angeles, US",NA,NA,"Second",NA,"Perished",NA,"Not Crew","Male","38"
"Mudd, Mr. Thomas Charles",16,"Huntingfield, Suffolk, England","Southampton","New York City",NA,NA,"Second",NA,"Perished",NA,"Not Crew","Male","16"
"Myles, Mr. Thomas Francis",63,"Fermoy, Ireland","Queenstown","Waban, Massachusetts, US",NA,NA,"Second",NA,"Perished",NA,"Not Crew","Male","63"
"Nassr Allah, Mr. Niqula Khalil",28,"Zahlé, Lebanon, Ottoman Empire","Cherbourg","Cleveland, Ohio, US",NA,"43","Second",NA,"Perished",NA,"Not Crew","Male","28"
"Nassr Allah, Mrs. Adal (née Akim)",14,"Zahlé, Lebanon, Ottoman Empire","Cherbourg","Cleveland, Ohio, US","?",NA,"Second",NA,"Survived",NA,"Not Crew","Female","14"
"Navratil, Mr. Michel (alias Louis M. Hoffman)",32,"Nice, France","Southampton","New York City",NA,"15","Second",NA,"Perished",NA,"Not Crew","Male","32"
"Navratil, Master Michel Marcel",3,"Nice, France","Southampton","New York City","D",NA,"Second",NA,"Survived",NA,"Not Crew","Male","3"
"Navratil, Master Edmond Roger",2,"Nice, France","Southampton","New York City","D",NA,"Second",NA,"Survived",NA,"Not Crew","Male","2"
"Nesson, Mr. Israel",26,"London, England","Southampton","Boston, Massachusetts, US",NA,NA,"Second",NA,"Perished",NA,"Not Crew","Male","26"
"Nicholls, Mr. Joseph Charles ""Joe""",19,"St. Ives, Cornwall, England","Southampton","Houghton, Michigan, US",NA,"101","Second",NA,"Perished",NA,"Not Crew","Male","19"
"Norman, Mr. Robert Douglas",28,"Glasgow, Scotland","Southampton","Houghton, Michigan, US",NA,"287","Second",NA,"Perished",NA,"Not Crew","Male","28"
"Nye, Mrs. Elizabeth (née Ramell)",29,"East Orange, New Jersey, US","Southampton","East Orange, New Jersey, US","11",NA,"Second",NA,"Survived",NA,"Not Crew","Female","29"
"Otter, Mr. Richard",39,"Middleburg Heights, Ohio, US","Southampton","Middleburg Heights, Ohio, US",NA,NA,"Second",NA,"Perished",NA,"Not Crew","Male","39"
"Oxenham, Mr. Percy Thomas",22,"London, England","Southampton","North Bergen, New Jersey, US","13",NA,"Second",NA,"Survived",NA,"Not Crew","Male","22"
"Padron Manent, Mr. Julian",26,"Barcelona, Spain","Cherbourg","Havana, Cuba","9",NA,"Second",NA,"Survived",NA,"Not Crew","Male","26"
"Pain, Dr. Alfred ""Alf""",23,"Hamilton, Ontario, Canada","Southampton","Hamilton, Ontario, Canada",NA,NA,"Second",NA,"Perished",NA,"Not Crew","Male","23"
"Pallas y Castello, Mr. Emilio",29,"Barcelona, Spain","Cherbourg","Havana, Cuba","9",NA,"Second",NA,"Survived",NA,"Not Crew","Male","29"
"Parker, Mr. Clifford Richard",28,"Guernsey, Channel Islands","Southampton","New York City",NA,NA,"Second",NA,"Perished",NA,"Not Crew","Male","28"
"Parkes, Mr. Francis ""Frank""",18,"Belfast, Ireland","Belfast","New York City",NA,NA,"Second",NA,"Perished",NA,"Not Crew","Male","18"
"Parrish, Mrs. Lutie Davis (née Temple)",60,"Woodford County, Kentucky, US","Southampton","Woodford County, Kentucky, US","12",NA,"Second",NA,"Survived",NA,"Not Crew","Female","60"
"Pengelly, Mr. Frederick William",19,"Gunnislake, Cornwall, England","Southampton","Butte, Montana, US",NA,NA,"Second",NA,"Perished",NA,"Not Crew","Male","19"
"Peruschitz, Father Josef",28,"Scheyern, Bavaria, German Empire","Southampton","St. Cloud, Minnesota, US",NA,NA,"Second",NA,"Perished",NA,"Not Crew","Male","28"
"Phillips, Mr. Escott Robert",42,"Ilfracombe, Devon, England","Southampton","New Brighton, Pennsylvania, US",NA,NA,"Second",NA,"Perished",NA,"Not Crew","Male","42"
"Phillips, Miss Alice Frances Louisa",21,"Ilfracombe, Devon, England","Southampton","New Brighton, Pennsylvania, US","12",NA,"Second",NA,"Survived",NA,"Not Crew","Female","21"
"Phillips, Miss Kate Florence (alias Mrs. Kate Marshall)",19,"Birmingham, Worcester, England","Southampton","Los Angeles, US","11",NA,"Second",NA,"Survived",NA,"Not Crew","Female","19"
"Pinsky, Mrs. Rosa",21,"Brooklyn, New York, US","Southampton","Brooklyn, New York, US","9",NA,"Second",NA,"Survived",NA,"Not Crew","Female","21"
"Ponesell, Mr. Martin",34,"Southampton, Hampshire, England","Southampton","New York City",NA,NA,"Second",NA,"Perished",NA,"Not Crew","Male","34"
"Portaluppi, Mr. Emilio Ilario Giuseppe",34,"Milford, New Hampshire, US","Southampton","Milford, New Hampshire, US","14",NA,"Second",NA,"Survived",NA,"Not Crew","Male","34"
"Pulbaum, Mr. Franz",27,"New York City","Southampton","New York City",NA,NA,"Second",NA,"Perished",NA,"Not Crew","Male","27"
"Quick, Mrs. Jane (née Richards)",33,"Plymouth, Devon, England","Southampton","Detroit, Michigan, US","11",NA,"Second",NA,"Survived",NA,"Not Crew","Female","33"
"Quick, Miss Winnifred Vera",8,"Plymouth, Devon, England","Southampton","Detroit, Michigan, US","11",NA,"Second",NA,"Survived",NA,"Not Crew","Female","8"
"Quick, Miss Phyllis May",2,"Plymouth, Devon, England","Southampton","Detroit, Michigan, US","11",NA,"Second",NA,"Survived",NA,"Not Crew","Female","2"
"Reeves, Mr. David",36,"Slinfold, West Sussex, England","Southampton","New York City",NA,NA,"Second",NA,"Perished",NA,"Not Crew","Male","36"
"Renouf, Mr. Peter Henry",33,"Elizabeth, New Jersey, US","Southampton","Elizabeth, New Jersey, US",NA,NA,"Second",NA,"Perished",NA,"Not Crew","Male","33"
"Renouf, Mrs. Lillian ""Lily"" (née Jefferys)",30,"Elizabeth, New Jersey, US","Southampton","Elizabeth, New Jersey, US","12",NA,"Second",NA,"Survived",NA,"Not Crew","Female","30"
"Reynaldo, Miss Encarnación",28,"Marbella, Spain","Southampton","New York City","9",NA,"Second",NA,"Survived",NA,"Not Crew","Female","28"
"Richard, Mr. Emile Philippe",23,"Paris, France","Cherbourg","Montreal, Quebec, Canada",NA,NA,"Second",NA,"Perished",NA,"Not Crew","Male","23"
"Richards, Mrs. Emily (née Hocking)",23,"Penzance, Cornwall, England","Southampton","Akron, Ohio, US","4",NA,"Second",NA,"Survived",NA,"Not Crew","Female","23"
"Richards, Master William Rowe",3,"Penzance, Cornwall, England","Southampton","Akron, Ohio, US","4",NA,"Second",NA,"Survived",NA,"Not Crew","Male","3"
"Richards, Master Sibley George",0,"Penzance, Cornwall, England","Southampton","Akron, Ohio, US","4",NA,"Second",NA,"Survived",NA,"Not Crew","Male","9 mo."
"Ridsdale, Miss Lucy",50,"London, England","Southampton","Marietta, Ohio, US","13",NA,"Second",NA,"Survived",NA,"Not Crew","Female","50"
"Rogers, Mr. Reginald Harry",18,"Tavistock, Devon, England","Southampton","Wilkes Barre, Pennsylvania, US",NA,NA,"Second",NA,"Perished",NA,"Not Crew","Male","18"
"Rugg, Miss Emily",21,"Guernsey, Channel Islands","Southampton","Wilmington, Delaware, US","12",NA,"Second",NA,"Survived",NA,"Not Crew","Female","21"
"Schmidt, Mr. August",26,"Newark, New Jersey, US","Southampton","Newark, New Jersey, US",NA,NA,"Second",NA,"Perished",NA,"Not Crew","Male","26"
"Sedgwick, Mr. Charles Frederick Waddington",25,"Liverpool, Merseyside, England","Southampton","Minatitlán, Veracruz, Mexico",NA,NA,"Second",NA,"Perished",NA,"Not Crew","Male","25"
"Sharp, Mr. Percival James",27,"London, England","Southampton","New York City",NA,NA,"Second",NA,"Perished",NA,"Not Crew","Male","27"
"Shelley, Mrs. Imanita (née Parrish Hall)",25,"Deer Lodge, Montana, US","Southampton","Deer Lodge, Montana, US","12",NA,"Second",NA,"Survived",NA,"Not Crew","Female","25"
"Silvén, Miss Lyyli Karolina",17,"Tornio, Finland, Russian Empire","Southampton","Minneapolis, Minnesota, US","16",NA,"Second",NA,"Survived",NA,"Not Crew","Female","17"
"Sincock, Miss Maude",20,"St. Ives, Cornwall, England","Southampton","Hancock, Michigan, US","11",NA,"Second",NA,"Survived",NA,"Not Crew","Female","20"
"Sinkkonen, Miss Anna",30,"Turku, Finland, Russian Empire","Southampton","Brighton, Boston, Massachusetts, US","10",NA,"Second",NA,"Survived",NA,"Not Crew","Female","30"
"Sjöstedt, Mr. Ernst Adolf",30,"Hjo, Västergötland, Sweden","Southampton","Sault Ste. Marie, Michigan, US","10",NA,"Second",NA,"Survived",NA,"Not Crew","Male","30"
"Slayter, Miss Hilda Mary",30,"Halifax, Nova Scotia, Canada","Queenstown","Vancouver, British Columbia, Canada","13",NA,"Second",NA,"Survived",NA,"Not Crew","Female","30"
"Slemen, Mr. Richard James",35,"Landrake, Cornwall, England","Southampton","Nashua, New Hampshire, US",NA,NA,"Second",NA,"Perished",NA,"Not Crew","Male","35"
"Smith, Miss Marion Elsie",39,"Basingstoke, Hampshire, England","Southampton","Washington, D.C. US","9",NA,"Second",NA,"Survived",NA,"Not Crew","Female","39"
"Sobey, Mr. Samuel James Hayden",25,"Porthallow, Cornwall, England","Southampton","Houghton, Michigan, US",NA,NA,"Second",NA,"Perished",NA,"Not Crew","Male","25"
"Stanton, Mr. Samuel Ward",42,"New York City","Southampton","New York City",NA,NA,"Second",NA,"Perished",NA,"Not Crew","Male","42"
"Stokes, Mr. Philip Joseph",25,"London, England","Southampton","Detroit, Michigan, US",NA,"81","Second",NA,"Perished",NA,"Not Crew","Male","25"
"Sweet, Mr. George Frederick",14,"Yeovil, Somerset, England","Southampton","Bernardsville, New Jersey, US",NA,NA,"Second",NA,"Perished",NA,"Not Crew","Male","14"
"Taylor, Mr. Percy Cornelius",32,"London, England","Southampton","New York City",NA,NA,"Second",NA,"Perished",NA,"Not Crew","Male","32"
"Toomey, Miss Ellen Mary",48,"Indianapolis, Indiana, US","Southampton","Indianapolis, Indiana, US","9",NA,"Second",NA,"Survived",NA,"Not Crew","Female","48"
"Troupiansky, Mr. Moses Aaron",23,"London, England","Southampton","New York City",NA,NA,"Second",NA,"Perished",NA,"Not Crew","Male","23"
"Trout, Mrs. Jessie L.",26,"Columbus, Ohio, US","Southampton","Columbus, Ohio, US","9",NA,"Second",NA,"Survived",NA,"Not Crew","Female","26"
"Troutt, Miss Edwina Celia ""Winnie""",27,"Bath, Somerset, England","Southampton","Auburndale, Florida, US","16",NA,"Second",NA,"Survived",NA,"Not Crew","Female","27"
"Turpin, Mr. William John Robert",29,"Plymouth, Devon, England","Southampton","Salt Lake City, Utah, US",NA,NA,"Second",NA,"Perished",NA,"Not Crew","Male","29"
"Turpin, Mrs. Dorothy Ann (née Wonnacott)",27,"Plymouth, Devon, England","Southampton","Salt Lake City, Utah, US",NA,NA,"Second",NA,"Perished",NA,"Not Crew","Female","27"
"Veal, Mr. James",40,"Barre, Vermont, US","Southampton","Barre, Vermont, US",NA,NA,"Second",NA,"Perished",NA,"Not Crew","Male","40"
"Wallcroft, Miss Ellen ""Nellie""",36,"Maidenhead, Berkshire, England","Southampton","Mamaroneck, New York, US","14",NA,"Second",NA,"Survived",NA,"Not Crew","Female","36"
"Ware, Mr. John James",45,"Bristol, Avon, England","Southampton","New Britain, Connecticut, US",NA,NA,"Second",NA,"Perished",NA,"Not Crew","Male","45"
"Ware, Mrs. Florence Louise (née Long)",31,"Bristol, Avon, England","Southampton","New Britain, Connecticut, US","10",NA,"Second",NA,"Survived",NA,"Not Crew","Female","31"
"Ware, Mr. William Jeffery",23,"Gunnislake, Cornwall, England","Southampton","Butte, Montana, US",NA,NA,"Second",NA,"Perished",NA,"Not Crew","Male","23"
"Watson, Mr. Ennis Hastings",15,"Belfast, Ireland","Belfast","New York City",NA,NA,"Second",NA,"Perished","Electrician's Apprentice","Crew","Male","15"
"Watt, Mrs. Elizabeth Inglis ""Bessie"" (née Milne)",40,"Aberdeen, Aberdeenshire, Scotland","Southampton","Portland, Oregon, US","9",NA,"Second",NA,"Survived",NA,"Not Crew","Female","40"
"Watt, Miss Robertha Josephine ""Bertha""",12,"Aberdeen, Aberdeenshire, Scotland","Southampton","Portland, Oregon, US","9",NA,"Second",NA,"Survived",NA,"Not Crew","Female","12"
"Webber, Miss Susan",37,"Bude, Cornwall, England","Southampton","Hartford, Connecticut, US","12",NA,"Second",NA,"Survived",NA,"Not Crew","Female","37"
"Weisz, Mr. Leopold",28,"Bromsgrove, Worcestershire, England","Southampton","Montreal, Quebec, Canada",NA,"293","Second",NA,"Perished",NA,"Not Crew","Male","28"
"Weisz, Mrs. Mathilde Françoise (née Pëde)",37,"Bromsgrove, Worcestershire, England","Southampton","Montreal, Quebec, Canada","10",NA,"Second",NA,"Survived",NA,"Not Crew","Female","37"
"Wells, Mrs. Addie Dart (née Trevaskis)",29,"Heamoor, Cornwall, England","Southampton","Akron, Ohio, US","14",NA,"Second",NA,"Survived",NA,"Not Crew","Female","29"
"Wells, Miss Joan",4,"Heamoor, Cornwall, England","Southampton","Akron, Ohio, US","14",NA,"Second",NA,"Survived",NA,"Not Crew","Female","4"
"Wells, Master Ralph Lester",2,"Heamoor, Cornwall, England","Southampton","Akron, Ohio, US","14",NA,"Second",NA,"Survived",NA,"Not Crew","Male","2"
"West, Mr. Edwy Arthur",36,"Bournemouth, Dorset, England","Southampton","Gainesville, Florida, US",NA,NA,"Second",NA,"Perished",NA,"Not Crew","Male","36"
"West, Mrs. Ada Mary (née Worth)",33,"Bournemouth, Dorset, England","Southampton","Gainesville, Florida, US","10",NA,"Second",NA,"Survived",NA,"Not Crew","Female","33"
"West, Miss Constance Mirium",4,"Bournemouth, Dorset, England","Southampton","Gainesville, Florida, US","10",NA,"Second",NA,"Survived",NA,"Not Crew","Female","4"
"West, Miss Barbara Joyce",0,"Bournemouth, Dorset, England","Southampton","Gainesville, Florida, US","10",NA,"Second",NA,"Survived",NA,"Not Crew","Female","10 mo."
"Wheadon, Mr. Edward H.",66,"Guernsey, Channel Islands","Southampton","Edgewood, Rhode Island, US",NA,NA,"Second",NA,"Perished",NA,"Not Crew","Male","66"
"Wheeler, Mr. Edwin Charles ""Fred""",24,"Bath, Somerset, England","Southampton","Asheville, North Carolina, US",NA,NA,"Second",NA,"Perished",NA,"Not Crew","Male","24"
"Whilems, Mr. Charles",32,"London, England","Southampton","New York City","9",NA,"Second",NA,"Survived",NA,"Not Crew","Male","32"
"Wilkinson, Miss Elizabeth Anne (alias Mrs. Elizabeth Faunthorpe)",29,"Manchester, England","Southampton","Philadelphia, Pennsylvania, US","16",NA,"Second",NA,"Survived",NA,"Not Crew","Female","29"
"Williams, Mr. Charles Eugene",23,"Harrow, London, England","Southampton","Chicago, Illinois, US","14",NA,"Second",NA,"Survived",NA,"Not Crew","Male","23"
"Woodward, Mr. John Wesley",32,"Oxford, Oxfordshire, England","Southampton","New York City",NA,NA,"Second",NA,"Perished",NA,"Not Crew","Male","32"
"Wright, Miss Marion",26,"Yeovil, Somerset, England","Southampton","Cottage Grove, Oregon, US","9",NA,"Second",NA,"Survived",NA,"Not Crew","Female","26"
"Yvois, Miss Henriette",24,"Paris, France","Southampton","Montreal, Quebec, Canada",NA,NA,"Second",NA,"Perished",NA,"Not Crew","Female","24"
"Abbing, Mr. Anthony",40,"Cincinnati, Ohio","Southampton","Cincinnati, Ohio, US",NA,NA,"Third","US","Perished",NA,"Not Crew","Male","40"
"Abbott, Mrs. Rhoda Mary (née Hunt)",39,"East Providence, Rhode Island","Southampton","East Providence, Rhode Island, US","A",NA,"Third","US","Survived",NA,"Not Crew","Female","39"
"Abbott, Mr. Rossmore Edward",16,"East Providence, Rhode Island","Southampton","East Providence, Rhode Island, US",NA,NA,"Third","US","Perished",NA,"Not Crew","Male","16"
"Abbott, Mr. Eugene Joseph",14,"East Providence, Rhode Island","Southampton","East Providence, Rhode Island, US",NA,NA,"Third","US","Perished",NA,"Not Crew","Male","14"
"Abd al-Khaliq, Mr. Farid Qasim Husayn",18,"Shana","Cherbourg","New York City",NA,NA,"Third","Lebanon","Perished",NA,"Not Crew","Male","18"
"Abelseth, Miss Karen Marie",16,"Sondmore","Southampton","Los Angeles, US","16",NA,"Third","Norway","Survived",NA,"Not Crew","Female","16"
"Abelseth, Mr. Olaus Jørgensen",25,"Perkins County, South Dakota","Southampton","Perkins County, South Dakota, US","A",NA,"Third","US","Survived",NA,"Not Crew","Male","25"
"Abrahamsson, Mr. Abraham August Johannes",20,"Dalsbruk","Southampton","Hoboken, New Jersey, US","15",NA,"Third","Finland","Survived",NA,"Not Crew","Male","20"
"Abrahim, Mrs. Mary Sophie Halaut (née Easu)",18,"Shwayhad","Cherbourg","Greensburg, Pennsylvania, US","C",NA,"Third","Syria","Survived",NA,"Not Crew","Female","18"
"Adahl, Mr. Mauritz Nils Martin",30,"Asarum, Småland","Southampton","Brooklyn, New York, US",NA,"72","Third","Sweden","Perished",NA,"Not Crew","Male","30"
"Adams, Mr. John",26,"Bournemouth, Dorset","Southampton","La Porte City, Iowa, US",NA,"103","Third","England","Perished",NA,"Not Crew","Male","26"
"Ahlin, Mrs. Johanna Persdotter (née Larsson)",40,"Göteborg, Västergötland","Southampton","Akeley, Minnesota, US",NA,NA,"Third","Sweden","Perished",NA,"Not Crew","Female","40"
"Aks, Mrs. Leah (née Rosen)",18,"London","Southampton","Norfolk, Virginia, US","13",NA,"Third","England","Survived",NA,"Not Crew","Female","18"
"Aks, Master Frank Philip",0,"London","Southampton","Norfolk, Virginia, US","11",NA,"Third","England","Survived",NA,"Not Crew","Male","10 mo."
"Al-Muna, Mr. Nasif Qasim",26,"Fredericksburg, Virginia","Cherbourg","Fredericksburg, Virginia, US","15",NA,"Third","US","Survived",NA,"Not Crew","Male","26"
"Alexander, Mr. William",23,"Great Yarmouth, Norfolk","Southampton","Albion, Michigan, US",NA,NA,"Third","England","Perished",NA,"Not Crew","Male","23"
"Alhomäki, Mr. Ilmari Rudolf",19,"Salo","Southampton","Astoria, Oregon, US",NA,NA,"Third","Finland","Perished",NA,"Not Crew","Male","19"
"Ali, Mr. Ahmed",24,"Buenos Aires","Southampton","New York City",NA,NA,"Third","Argentina","Perished",NA,"Not Crew","Male","24"
"Ali, Mr. William",25,"Buenos Aires","Southampton","New York City",NA,"79","Third","Argentina","Perished",NA,"Not Crew","Male","25"
"Allen, Mr. William Henry",35,"Birmingham, West Midlands","Southampton","New York City",NA,NA,"Third","England","Perished",NA,"Not Crew","Male","35"
"Allum, Mr. Owen George",15,"Southall, London","Southampton","New York City",NA,"259","Third","England","Perished",NA,"Not Crew","Male","15"
"Al-Zainni, Mr. Fahim Ruhanna",22,"Toula","Cherbourg","Dayton, Ohio, US","6",NA,"Third","Lebanon","Survived",NA,"Not Crew","Male","22"
"Andersen, Mr. Albert Karvin",33,"Bergen","Southampton","New York City",NA,"260","Third","Norway","Perished",NA,"Not Crew","Male","33"
"Andersen-Jensen, Miss Carla Christine",19,"Eskilstrup","Southampton","Portland, Oregon, US","16",NA,"Third","Denmark","Survived",NA,"Not Crew","Female","19"
"Andersson, Mr. Anders Johan",39,"Kisa, Östergötland","Southampton","Winnipeg, Manitoba, Canada",NA,NA,"Third","Sweden","Perished",NA,"Not Crew","Male","39"
"Andersson, Mrs. Alfrida Konstantia (née Brogren)",39,"Kisa, Östergötland","Southampton","Winnipeg, Manitoba, Canada",NA,NA,"Third","Sweden","Perished",NA,"Not Crew","Female","39"
"Andersson, Miss Sigrid Elisabeth",11,"Kisa, Östergötland","Southampton","Winnipeg, Manitoba, Canada",NA,NA,"Third","Sweden","Perished",NA,"Not Crew","Female","11"
"Andersson, Miss Ingeborg Constanzia",9,"Kisa, Östergötland","Southampton","Winnipeg, Manitoba, Canada",NA,NA,"Third","Sweden","Perished",NA,"Not Crew","Female","9"
"Andersson, Miss Ebba Iris Alfrida",6,"Kisa, Östergötland","Southampton","Winnipeg, Manitoba, Canada",NA,NA,"Third","Sweden","Perished",NA,"Not Crew","Female","6"
"Andersson, Master Sigvard Harald Elias",4,"Kisa, Östergötland","Southampton","Winnipeg, Manitoba, Canada",NA,NA,"Third","Sweden","Perished",NA,"Not Crew","Male","4"
"Andersson, Miss Ellis Anna Maria",2,"Kisa, Östergötland","Southampton","Winnipeg, Manitoba, Canada",NA,NA,"Third","Sweden","Perished",NA,"Not Crew","Female","2"
"Andersson, Miss Erna Alexandra",17,"Kullaa","Southampton","New York City","D",NA,"Third","Finland","Survived",NA,"Not Crew","Female","17"
"Andersson, Miss Ida Augusta Margareta",38,"Vadsbro, Sörmland","Southampton","Manistee, Michigan, US",NA,NA,"Third","Sweden","Perished",NA,"Not Crew","Female","38"
"Andersson, Mr. Johan Samuel",26,"Hartford, Connecticut","Southampton","Hartford, Connecticut, US",NA,NA,"Third","US","Perished",NA,"Not Crew","Male","26"
"Andreasson, Mr. Paul Edvin",20,"Kalfsnäs, Småland","Southampton","Chicago, Illinois, US",NA,NA,"Third","Sweden","Perished",NA,"Not Crew","Male","20"
"Angheloff, Mr. Minko",26,"Terziysko, Troyan","Southampton","Chicago, Illinois, US",NA,NA,"Third","Bulgaria","Perished",NA,"Not Crew","Male","26"
"Arnold-Franchi, Mr. Josef",25,"Altdorf, Uri","Southampton","New Glarus, Wisconsin, US",NA,NA,"Third","Switzerland","Perished",NA,"Not Crew","Male","25"
"Arnold-Franchi, Mrs. Josefine (née Franchi)",18,"Altdorf, Uri","Southampton","New Glarus, Wisconsin, US",NA,NA,"Third","Switzerland","Perished",NA,"Not Crew","Female","18"
"Aronsson, Mr. Ernst Axel Algot",24,"Horset, Småland","Southampton","Joliet, Illinois, US",NA,NA,"Third","Sweden","Perished",NA,"Not Crew","Male","24"
"Asim, Mr. Adola",35,"Buenos Aires","Southampton","New York City",NA,NA,"Third","Argentina","Perished",NA,"Not Crew","Male","35"
"Asplund, Mr. Carl Oscar Vilhelm Gustafsson",40,"Alseda, Småland","Southampton","Worcester, Massachusetts, US",NA,"142","Third","Sweden","Perished",NA,"Not Crew","Male","40"
"Asplund, Mrs. Selma Augusta Emilia (née Johansson)",38,"Alseda, Småland","Southampton","Worcester, Massachusetts, US","15",NA,"Third","Sweden","Survived",NA,"Not Crew","Female","38"
"Asplund, Master Filip Oscar",13,"Alseda, Småland","Southampton","Worcester, Massachusetts, US",NA,NA,"Third","Sweden","Perished",NA,"Not Crew","Male","13"
"Asplund, Master Clarence Gustaf Hugo",9,"Alseda, Småland","Southampton","Worcester, Massachusetts, US",NA,NA,"Third","Sweden","Perished",NA,"Not Crew","Male","9"
"Asplund, Master Carl Edgar",5,"Alseda, Småland","Southampton","Worcester, Massachusetts, US",NA,NA,"Third","Sweden","Perished",NA,"Not Crew","Male","5"
"Asplund, Miss Lillian Gertrud",5,"Alseda, Småland","Southampton","Worcester, Massachusetts, US","15",NA,"Third","Sweden","Survived",NA,"Not Crew","Female","5"
"Asplund, Master Edvin Rojj Felix",3,"Alseda, Småland","Southampton","Worcester, Massachusetts, US","15",NA,"Third","Sweden","Survived",NA,"Not Crew","Male","3"
"Asplund, Mr. Johan Charles",23,"Oskarshamn, Kalmar","Southampton","Minneapolis, Minnesota, US","13",NA,"Third","Sweden","Survived",NA,"Not Crew","Male","23"
"Assaf, Mrs. Mariyam (née Khalil)",45,"Kafr Mishki","Cherbourg","Ottawa, Ontario, Canada","C",NA,"Third","Lebanon","Survived",NA,"Not Crew","Female","45"
"Assam, Mr. Ali",23,"Buenos Aires","Southampton","New York City",NA,NA,"Third","Argentina","Perished",NA,"Not Crew","Male","23"
"Attala, Mr. Sleiman",30,"Ottawa, Ontario","Cherbourg","Ottawa, Ontario, Canada",NA,NA,"Third","Canada","Perished",NA,"Not Crew","Male","30"
"Atta Allah, Miss Malakah",17,"Beirut","Cherbourg","New York City",NA,NA,"Third","Lebanon","Perished",NA,"Not Crew","Female","17"
"Augustsson, Mr. Albert",23,"Krakoryd, Småland","Southampton","Bloomington, Indiana, US",NA,NA,"Third","Sweden","Perished",NA,"Not Crew","Male","23"
"Ayyub Dahir, Miss Bannurah",15,"Beirut","Cherbourg","Owen Sound, Ontario, Canada","C",NA,"Third","Lebanon","Survived",NA,"Not Crew","Female","15"
"Bakus, Mr. Raful",20,"Unknown","Cherbourg","New York City",NA,NA,"Third","Lebanon","Perished",NA,"Not Crew","Male","20"
"Backström, Mr. Karl Alfred",32,"Kotka","Southampton","New York City",NA,NA,"Third","Finland","Perished",NA,"Not Crew","Male","32"
"Backström, Mrs. Maria Mathilda (née Gustafsson)",33,"Kotka","Southampton","New York City","D",NA,"Third","Finland","Survived",NA,"Not Crew","Female","33"
"Badman, Miss Emily Louisa",18,"Clevedon, North Somerset","Southampton","Skaneateles, New York, US","C",NA,"Third","England","Survived",NA,"Not Crew","Female","18"
"Badt, Mr. Mohamed",40,"Tripoli","Cherbourg","New York City",NA,NA,"Third","Lebanon","Perished",NA,"Not Crew","Male","40"
"Bakić, Mr. Kerim",26,"Bosanska Krupa","Southampton","Harrisburg, Pennsylvania, US",NA,NA,"Third","Bosnia","Perished",NA,"Not Crew","Male","26"
